{
  "id": "79b73903-e337-49ae-a318-d1a81cce4fbc",
  "title": "Weather With You",
  "key": null,
  "artist": "Crowded House",
  "sections": [
    {
      "id": "d8979bbc-0e23-4770-a470-9c5f207c9467",
      "name": "Intro",
      "position": 0,
      "phrases": [
        {
          "id": "e714c0ab-3680-4b9b-b20f-f327e5138270",
          "position": 0,
          "repeats": 1,
          "lyric": {
            "id": "6a12f8db-a011-4ea4-9648-6505f0f1a345",
            "text": ""
          },
          "chordSequence": {
            "id": "37e0acc7-5930-4215-8c17-ced36d746ef0",
            "sequence": [
              {
                "id": "5e773053-2d81-4175-8435-819b219ca53d",
                "step": 1,
                "chord": {
                  "id": "c0d4117c-b03b-480a-8792-1fd09704c597",
                  "root_note": "E",
                  "root_note_alteration": "natural",
                  "chord_type": "seventh",
                  "seventh_type": "minor",
                  "extended_type": null,
                  "suspended_type": null,
                  "added_type": null,
                  "added_alteration": "natural",
                  "bass_note": null,
                  "bass_note_alteration": null,
                  "image_path": null
                }
              },
              {
                "id": "4862d7ce-0a26-482b-a6e3-f88c6d75b9ea",
                "step": 9,
                "chord": {
                  "id": "f90b25c3-f046-4534-b6b0-177eaeb86d5b",
                  "root_note": "A",
                  "root_note_alteration": "natural",
                  "chord_type": "major",
                  "seventh_type": null,
                  "extended_type": null,
                  "suspended_type": null,
                  "added_type": null,
                  "added_alteration": "natural",
                  "bass_note": null,
                  "bass_note_alteration": null,
                  "image_path": null
                }
              },
              {
                "id": "296b540a-c7eb-402e-aa12-205f0bb4332c",
                "step": 11,
                "chord": {
                  "id": "224010e3-58cc-4b4f-9b46-58b6e2c0035f",
                  "root_note": "A",
                  "root_note_alteration": "natural",
                  "chord_type": "major",
                  "seventh_type": null,
                  "extended_type": null,
                  "suspended_type": "fourth",
                  "added_type": null,
                  "added_alteration": "natural",
                  "bass_note": null,
                  "bass_note_alteration": null,
                  "image_path": null
                }
              },
              {
                "id": "f956fdec-adc8-421c-9c51-6a5f2b8b2886",
                "step": 18,
                "chord": {
                  "id": "49161a7c-50db-4e1a-8439-e667d81e4f5e",
                  "root_note": "A",
                  "root_note_alteration": "natural",
                  "chord_type": "major",
                  "seventh_type": null,
                  "extended_type": null,
                  "suspended_type": null,
                  "added_type": null,
                  "added_alteration": "natural",
                  "bass_note": null,
                  "bass_note_alteration": null,
                  "image_path": null
                }
              },
              {
                "id": "870bfe0a-5bec-4ea0-8d34-d056ffd1146b",
                "step": 20,
                "chord": {
                  "id": "926d043c-2525-4002-914d-782cd96ba695",
                  "root_note": "E",
                  "root_note_alteration": "natural",
                  "chord_type": "seventh",
                  "seventh_type": "minor",
                  "extended_type": null,
                  "suspended_type": null,
                  "added_type": null,
                  "added_alteration": "natural",
                  "bass_note": null,
                  "bass_note_alteration": null,
                  "image_path": null
                }
              },
              {
                "id": "2fa2b57b-0604-4f1a-8d43-8be66e654f54",
                "step": 28,
                "chord": {
                  "id": "7bc41758-5e7d-4239-b916-f09cb2097feb",
                  "root_note": "A",
                  "root_note_alteration": "natural",
                  "chord_type": "major",
                  "seventh_type": null,
                  "extended_type": null,
                  "suspended_type": "fourth",
                  "added_type": null,
                  "added_alteration": "natural",
                  "bass_note": null,
                  "bass_note_alteration": null,
                  "image_path": null
                }
              },
              {
                "id": "7fc7379e-452d-47c4-b45b-716dfca6aa85",
                "step": 34,
                "chord": {
                  "id": "5bd4a35e-2622-4155-b9ef-3527c8f56561",
                  "root_note": "A",
                  "root_note_alteration": "natural",
                  "chord_type": "major",
                  "seventh_type": null,
                  "extended_type": null,
                  "suspended_type": null,
                  "added_type": null,
                  "added_alteration": "natural",
                  "bass_note": null,
                  "bass_note_alteration": null,
                  "image_path": null
                }
              },
              {
                "id": "3f605133-100e-4f73-9cf9-a32238bf06ef",
                "step": 37,
                "chord": {
                  "id": "13a7bb8c-6a14-4d4f-b76b-1099e5f49da3",
                  "root_note": "A",
                  "root_note_alteration": "natural",
                  "chord_type": "major",
                  "seventh_type": null,
                  "extended_type": null,
                  "suspended_type": null,
                  "added_type": null,
                  "added_alteration": "natural",
                  "bass_note": null,
                  "bass_note_alteration": null,
                  "image_path": null
                }
              },
              {
                "id": "a7c162c2-cc4c-43bf-8efa-d9dbee97f9b0",
                "step": 39,
                "chord": {
                  "id": "7f81b0f8-41ad-4521-8d5a-a24c0df21997",
                  "root_note": "E",
                  "root_note_alteration": "natural",
                  "chord_type": "seventh",
                  "seventh_type": "minor",
                  "extended_type": null,
                  "suspended_type": null,
                  "added_type": null,
                  "added_alteration": "natural",
                  "bass_note": null,
                  "bass_note_alteration": null,
                  "image_path": null
                }
              },
              {
                "id": "4f0d28c0-6990-40a3-ac83-62d3d133de77",
                "step": 47,
                "chord": {
                  "id": "6546fc7d-b387-4494-8ea0-ac9c3be7527e",
                  "root_note": "A",
                  "root_note_alteration": "natural",
                  "chord_type": "major",
                  "seventh_type": null,
                  "extended_type": null,
                  "suspended_type": null,
                  "added_type": null,
                  "added_alteration": "natural",
                  "bass_note": null,
                  "bass_note_alteration": null,
                  "image_path": null
                }
              },
              {
                "id": "b87e49db-c343-4f24-b5a3-ad5eecaad7ab",
                "step": 49,
                "chord": {
                  "id": "c5d22f55-4ec7-4150-b100-d7abf0dc1fb5",
                  "root_note": "A",
                  "root_note_alteration": "natural",
                  "chord_type": "major",
                  "seventh_type": null,
                  "extended_type": null,
                  "suspended_type": "fourth",
                  "added_type": null,
                  "added_alteration": "natural",
                  "bass_note": null,
                  "bass_note_alteration": null,
                  "image_path": null
                }
              },
              {
                "id": "1c640a39-e779-4503-a86f-26010dc556cb",
                "step": 56,
                "chord": {
                  "id": "e780ead1-d27f-4c0f-bb0f-46c06895252e",
                  "root_note": "A",
                  "root_note_alteration": "natural",
                  "chord_type": "major",
                  "seventh_type": null,
                  "extended_type": null,
                  "suspended_type": null,
                  "added_type": null,
                  "added_alteration": "natural",
                  "bass_note": null,
                  "bass_note_alteration": null,
                  "image_path": null
                }
              },
              {
                "id": "84f01cf6-f304-4754-a30a-7073656be75a",
                "step": 58,
                "chord": {
                  "id": "a37863a3-8961-491a-91c9-ce204da6a46d",
                  "root_note": "E",
                  "root_note_alteration": "natural",
                  "chord_type": "seventh",
                  "seventh_type": "minor",
                  "extended_type": null,
                  "suspended_type": null,
                  "added_type": null,
                  "added_alteration": "natural",
                  "bass_note": null,
                  "bass_note_alteration": null,
                  "image_path": null
                }
              }
            ]
          }
        }
      ]
    },
    {
      "id": "ad187537-4f68-4e03-ab3b-048443d1e619",
      "name": "Verse",
      "position": 1,
      "phrases": [
        {
          "id": "07983b6a-e5fe-46e6-b8ae-322bcb756057",
          "position": 0,
          "repeats": 1,
          "lyric": {